{
  "$schema": "https://json-schema.org/draft/2020-12/schema",
  "$id": "https://deep-research-skill/schemas/research-run-state.json",
  "title": "Research Run State Contract",
  "description": "Minimal process-state contract for long-running or multi-track research (issue #417). phase is the pipeline stage; status is the run overlay. This is not a second interpretation of Research Pack research_status / Final audit status / delivery_status. Runtime enforcement lives in scripts/validate_research_run_state.py. Single-track research does not create a Run State unless the user explicitly resumes a previous run_id.",
  "version": 1,
  "schema_version": "1",
  "type": "object",
  "additionalProperties": false,
  "required": [
    "schema_version",
    "run_id",
    "artifact_id",
    "phase",
    "status",
    "current_artifact_sha256",
    "activation_reference",
    "pending_decision",
    "last_transition_reason",
    "updated_at",
    "enabled_reason"
  ],
  "allOf": [
    {
      "if": {
        "properties": {"status": {"enum": ["partial", "blocked"]}},
        "required": ["status"]
      },
      "then": {
        "required": ["status_reason"],
        "description": "partial and blocked runs must record the gap or block and its impact."
      }
    },
    {
      "if": {
        "properties": {"status": {"const": "blocked"}},
        "required": ["status"]
      },
      "then": {
        "required": ["recovery_action"],
        "description": "blocked runs must state how the run can be resumed."
      }
    },
    {
      "if": {
        "properties": {"phase": {"const": "delivered"}},
        "required": ["phase"]
      },
      "then": {
        "properties": {
          "status": {"const": "completed"},
          "pending_decision": {"type": "null"}
        },
        "description": "delivered is the success terminal: status must be completed and pending_decision must be consumed."
      }
    },
    {
      "if": {
        "properties": {"phase": {"const": "mid_review"}, "status": {"enum": ["in_progress", "paused"]}},
        "required": ["phase", "status"]
      },
      "then": {
        "properties": {
          "pending_decision": {
            "enum": ["continue", "narrow", "pivot", "stop-and-synthesize"]
          }
        },
        "description": "mid_review is a mandatory user checkpoint."
      }
    }
  ],
  "properties": {
    "schema_version": {
      "type": "string",
      "const": "1",
      "description": "Contract version. Consumers reject unknown versions instead of guessing."
    },
    "run_id": {
      "type": "string",
      "minLength": 1,
      "description": "Stable identifier for this run, e.g. research-run-2026-08-25-001. Unchanged across pause/resume."
    },
    "artifact_id": {
      "type": "string",
      "minLength": 1,
      "description": "Identity of the process artifact this run is bound to (typically the Research Pack artifact_id)."
    },
    "phase": {
      "type": "string",
      "enum": [
        "intake",
        "route_locked",
        "collecting",
        "mid_review",
        "synthesizing",
        "auditing",
        "delivered"
      ],
      "description": "Pipeline stage. Not a result status: partial/blocked/completed are status values, never phases."
    },
    "status": {
      "type": "string",
      "enum": [
        "in_progress",
        "paused",
        "partial",
        "blocked",
        "completed",
        "aborted"
      ],
      "description": "Run overlay. Mapping to Research Pack: partial/blocked may correspond to research_status; completed does not prove content-audit Pass or delivery_status=md_ready. paused/in_progress/phase are process-only and must not be written as Pack research_status."
    },
    "current_artifact_sha256": {
      "type": "string",
      "pattern": "^[0-9a-f]{64}$",
      "description": "SHA-256 of the current process artifact bytes (the Research Pack file identified by artifact_id). Hash change invalidates delivered and any audit/handoff bound to the old bytes."
    },
    "parent_artifact_id": {
      "type": "string",
      "minLength": 1,
      "description": "Optional parent artifact id when this run is nested under a larger research artifact."
    },
    "activation_reference": {
      "type": "object",
      "additionalProperties": false,
      "required": [
        "activation_id",
        "snapshot_sha256",
        "snapshot_version",
        "decision_tree_version"
      ],
      "properties": {
        "activation_id": {"type": "string", "minLength": 1},
        "snapshot_sha256": {"type": "string", "pattern": "^[0-9a-f]{64}$"},
        "snapshot_version": {"type": "integer", "minimum": 1},
        "decision_tree_version": {"type": "integer", "minimum": 1}
      },
      "description": "Stable reference into an activation snapshot. Run State must not copy route/discipline/audit semantics."
    },
    "pending_decision": {
      "type": ["string", "null"],
      "enum": [
        "continue",
        "narrow",
        "pivot",
        "stop-and-synthesize",
        "confirm-boundary",
        "confirm-delivery",
        null
      ],
      "description": "Unconsumed user checkpoint. mid_review requires continue/narrow/pivot/stop-and-synthesize. delivered requires null. Resume must re-check this field."
    },
    "last_transition_reason": {
      "type": "string",
      "minLength": 1,
      "description": "Why the run entered its current (phase, status) pair."
    },
    "updated_at": {
      "type": "string",
      "description": "ISO-8601 date (2026-08-25) or timezone-aware RFC 3339 timestamp. Naive datetimes and impossible calendar values fail validation."
    },
    "enabled_reason": {
      "type": "string",
      "enum": ["parallel", "explicit_resume"],
      "description": "Why this Run State exists. parallel requires activation parallelization_decision=parallel when a snapshot is supplied. explicit_resume is the only lawful gate for single-track. Never enable because a Research Pack exists."
    },
    "status_reason": {
      "type": "string",
      "minLength": 1,
      "description": "Required for partial and blocked: the gap or block and its impact."
    },
    "recovery_action": {
      "type": "string",
      "minLength": 1,
      "description": "Required for blocked: what should be retried and how."
    },
    "next_action": {
      "type": "string",
      "minLength": 1,
      "description": "Optional human-readable next legal action."
    },
    "handoff_refs": {
      "type": "array",
      "description": "Optional bindings to Track Handoff artifacts. Required when enabled_reason=parallel and phase is synthesizing, auditing, or delivered. Tampering a listed handoff file fails closed.",
      "items": {
        "type": "object",
        "additionalProperties": false,
        "required": ["handoff_id", "sha256"],
        "properties": {
          "handoff_id": {"type": "string", "minLength": 1},
          "sha256": {"type": "string", "pattern": "^[0-9a-f]{64}$"}
        }
      }
    }
  },
  "examples": [
    "tests/fixtures/research-run-state/valid-collecting.json",
    "tests/fixtures/research-run-state/valid-mid-review.json",
    "tests/fixtures/research-run-state/valid-delivered.json",
    "tests/fixtures/research-run-state/valid-paused.json",
    "tests/fixtures/research-run-state/valid-partial.json",
    "tests/fixtures/research-run-state/valid-blocked.json",
    "tests/fixtures/research-run-state/valid-explicit-resume.json"
  ]
}
